{
  "$schema": "http://json-schema.org/draft-07/schema#",
  "$id": "https://qaizen/schemas/test-cases.schema.json",
  "title": "Test Cases for a Story",
  "description": "test-cases/[story-id].json. The Test Designer's primary output. Every TC carries an Automation Decision with a non-empty reason; see docs/automation-decision-model.md. Risk linkage is mandatory; see docs/traceability.md.",
  "type": "object",
  "additionalProperties": false,
  "required": ["schema_version", "run_id", "story_id", "test_cases"],
  "properties": {
    "schema_version": {
      "type": "string",
      "pattern": "^[0-9]+\\.[0-9]+(\\.[0-9]+)?$"
    },
    "run_id": {
      "type": "string",
      "minLength": 1
    },
    "story_id": {
      "type": "string",
      "description": "Must match context.json.story.id.",
      "pattern": "^(STORY-[0-9]+|[A-Z][A-Z0-9_]*-[0-9]+)$"
    },
    "generated_at": {
      "type": "string",
      "description": "ISO 8601 timestamp. Optional."
    },
    "test_cases": {
      "type": "array",
      "minItems": 1,
      "items": { "$ref": "#/definitions/testCase" }
    }
  },
  "definitions": {
    "testCase": {
      "type": "object",
      "additionalProperties": false,
      "required": [
        "test_case_id",
        "title",
        "description",
        "risk_ids",
        "acceptance_criteria_refs",
        "priority",
        "test_level_recommendation",
        "automation_decision",
        "automation_decision_reason",
        "preconditions",
        "steps",
        "expected_results",
        "status"
      ],
      "properties": {
        "test_case_id": {
          "type": "string",
          "pattern": "^TC-[0-9]+$"
        },
        "title": { "type": "string", "minLength": 1 },
        "description": { "type": "string", "minLength": 1 },
        "risk_ids": {
          "type": "array",
          "description": "MUST reference >=1 RISK-XXX from context.json.risks[].",
          "minItems": 1,
          "items": {
            "type": "string",
            "pattern": "^RISK-[0-9]+$"
          }
        },
        "acceptance_criteria_refs": {
          "type": "array",
          "description": "Indices (0-based) into context.json.acceptance_criteria.",
          "items": { "type": "integer", "minimum": 0 }
        },
        "priority": {
          "type": "string",
          "enum": ["P0", "P1", "P2", "P3"]
        },
        "test_level_recommendation": {
          "type": "string",
          "enum": ["unit", "component", "integration", "e2e", "api"]
        },
        "automation_decision": {
          "type": "string",
          "enum": [
            "automate_e2e",
            "automate_api",
            "automate_component",
            "manual",
            "skip"
          ]
        },
        "automation_decision_reason": {
          "type": "string",
          "description": "Non-empty. Must be a real explanation, not a restatement of the decision. Generic reasons are a Gate 2 rejection per docs/review-gates.md.",
          "minLength": 1
        },
        "preconditions": {
          "type": "array",
          "items": { "type": "string", "minLength": 1 }
        },
        "steps": {
          "type": "array",
          "items": {
            "type": "object",
            "additionalProperties": false,
            "required": ["step_id", "action"],
            "properties": {
              "step_id": {
                "type": "string",
                "description": "e.g. 'S-01', 'S-02'. Stable inside this test case.",
                "minLength": 1
              },
              "action": { "type": "string", "minLength": 1 },
              "data": {
                "description": "Optional. Free-form input data for the step.",
                "type": [
                  "string",
                  "object",
                  "array",
                  "number",
                  "boolean",
                  "null"
                ]
              }
            }
          }
        },
        "expected_results": {
          "type": "array",
          "minItems": 1,
          "items": { "type": "string", "minLength": 1 }
        },
        "status": {
          "type": "string",
          "enum": ["draft", "approved", "rejected"]
        },
        "design_stage": {
          "type": "string",
          "description": "OPTIONAL (shift-left). The lifecycle stage at which this case was designed. 'pre_development' = produced during refinement, before code exists (acts as a shared acceptance contract); 'ready_for_qa' = revisited/validated once the implementation exists. Absent => treated as ready_for_qa (the single-entry-point default). Orthogonal to 'status' (the Gate-2 approval state).",
          "enum": ["pre_development", "ready_for_qa"]
        },
        "qmetry_fields": {
          "type": "object",
          "description": "Reserved forward-compatibility slot. Phase 1 leaves this empty; future phases may bind a schema."
        },
        "testlink_id": {
          "type": "string",
          "description": "Populated by Phase 2 syncing-testlink skill. Empty/omitted in Phase 1. DEPRECATED in favor of external_ids.testlink (Phase 2.6) but kept valid for backward compatibility; the TestLink adapter still writes it."
        },
        "external_ids": {
          "type": "object",
          "description": "Generic tool -> external id linkage written back by a TestManagementAdapter after a push (e.g. {\"jira\": \"SK-50\", \"qase\": \"123\"}). Open/Closed: a new adapter records its id here without adding a new per-tool field. testlink_id remains the TestLink adapter's dedicated field for compatibility; new adapters use this object. Keys are tool names; values are the tool's issue/case id.",
          "additionalProperties": { "type": "string" }
        },
        "sync_state": { "$ref": "#/definitions/syncState" },
        "api_metadata": {
          "type": "object",
          "additionalProperties": false,
          "description": "API-branch extension. Optional. Populated only when automation_decision == 'automate_api'; E2E-only cases leave this unset.",
          "properties": {
            "method": {
              "type": "string",
              "enum": [
                "GET",
                "POST",
                "PUT",
                "PATCH",
                "DELETE",
                "HEAD",
                "OPTIONS"
              ]
            },
            "endpoint": { "type": "string", "minLength": 1 },
            "request_body_schema_ref": { "type": "string" },
            "response_schema_ref": { "type": "string" },
            "auth_required": { "type": "boolean" },
            "expected_status_codes": {
              "type": "array",
              "items": { "type": "integer", "minimum": 100, "maximum": 599 }
            }
          }
        }
      }
    },
    "syncState": {
      "type": "object",
      "description": "Optional. Per-target record of external synchronization, keyed by target tool (e.g. \"jira\", \"testlink\"). Written by the adapters in scripts/ so a create survives a later failure: the intent is saved before the request and the remote id immediately after it. Never holds credentials. Like testlink_id and external_ids, it records WHERE a case was pushed, not WHAT it says, so it never invalidates an approval. The same shape is used in bug drafts (docs/bug-draft-format.md, \"## Sync State\").",
      "propertyNames": {
        "pattern": "^[a-z][a-z0-9_-]*$"
      },
      "additionalProperties": {
        "$ref": "#/definitions/syncRecord"
      }
    },
    "syncRecord": {
      "type": "object",
      "additionalProperties": false,
      "required": ["operation_key", "marker", "state", "intent_at"],
      "properties": {
        "operation_key": {
          "type": "string",
          "minLength": 1,
          "description": "Stable identity: target:project:story:local-id:operation-kind."
        },
        "marker": {
          "type": "string",
          "pattern": "^qaizen-op-[0-9a-f]{12}$",
          "description": "Short digest of operation_key, sent with the create so an uncertain outcome can be reconciled by a read-only remote search."
        },
        "marker_searchable": {
          "type": "boolean",
          "description": "false when the remote rejected the field carrying the marker and the create was resent without it; such an operation can only be resolved by a human."
        },
        "payload_digest": {
          "type": "string",
          "pattern": "^[0-9a-f]{64}$",
          "description": "SHA-256 of the canonical payload last sent (or about to be sent)."
        },
        "source_digest": {
          "type": "string",
          "pattern": "^[0-9a-f]{64}$",
          "description": "SHA-256 of the local item's content (without its sync linkage) when it was pushed. A later difference means the local item changed after the push; adapters report it and never update the remote copy."
        },
        "state": {
          "enum": ["pending", "created", "failed", "not_found"],
          "description": "pending: intent saved, outcome not yet known. created: remote id known. failed: the remote definitely rejected the create (nothing exists). not_found: a pending operation was reconciled and nothing exists remotely."
        },
        "remote_id": {
          "type": "string",
          "minLength": 1
        },
        "link_state": {
          "enum": ["not_applicable", "pending", "linked", "failed"],
          "description": "Optional follow-up link to the story issue. A failed link is retried on a later run without recreating the item."
        },
        "intent_at": {
          "type": "string",
          "format": "date-time"
        },
        "created_at": {
          "type": "string",
          "format": "date-time"
        },
        "linked_at": {
          "type": "string",
          "format": "date-time"
        },
        "reconciled_at": {
          "type": "string",
          "format": "date-time"
        },
        "updated_at": {
          "type": "string",
          "format": "date-time"
        },
        "last_error": {
          "type": "string",
          "maxLength": 500,
          "description": "Sanitized diagnostic of the last failure. Never contains credentials."
        }
      },
      "if": {
        "properties": {
          "state": {
            "const": "created"
          }
        }
      },
      "then": {
        "required": ["remote_id"]
      }
    }
  }
}
