{
  "schema_version": "1.0",
  "run_id": "2026-09-27T14-00-00Z-sync",
  "story_id": "SK-1042",
  "generated_at": "2026-05-28T18:05:00Z",
  "test_cases": [
    {
      "test_case_id": "TC-001",
      "title": "Valid user sees inventory after login",
      "description": "[Use case] Happy path: a registered, non-locked user signs in with correct credentials and reaches the inventory list.",
      "risk_ids": ["RISK-001"],
      "acceptance_criteria_refs": [0],
      "priority": "P0",
      "test_level_recommendation": "e2e",
      "automation_decision": "automate_e2e",
      "automation_decision_reason": "The AC is about the user journey through the UI — they submit the form and land on the inventory page. The journey crosses page boundaries; an API check alone would not validate that the redirect and inventory render correctly.",
      "preconditions": [
        "A non-locked user account exists in the test environment.",
        "BASE_URL points at the login page."
      ],
      "steps": [
        {
          "step_id": "S-01",
          "action": "Navigate to BASE_URL."
        },
        {
          "step_id": "S-02",
          "action": "Fill the username field.",
          "data": "standard_user"
        },
        {
          "step_id": "S-03",
          "action": "Fill the password field.",
          "data": "secret_sauce"
        },
        {
          "step_id": "S-04",
          "action": "Click the Login button."
        }
      ],
      "expected_results": [
        "URL changes to the inventory page.",
        "At least one inventory item is visible on the page."
      ],
      "status": "approved",
      "external_ids": {
        "jira": "SK-1101"
      },
      "sync_state": {
        "jira": {
          "operation_key": "jira:SK:SK-1042:TC-001:create_case",
          "marker": "qaizen-op-5e0bae3a3aad",
          "marker_searchable": true,
          "payload_digest": "995c689e594dffd26d6f6614db9dfb4191fa293f5a2bde787f03878a7d99b9ab",
          "source_digest": "92d64cf2d5174bd391f5b359550d394a0f7a85e611c4a7e3db2b866ab8cbd449",
          "state": "created",
          "remote_id": "SK-1101",
          "link_state": "linked",
          "intent_at": "2026-09-27T14:02:11Z",
          "created_at": "2026-09-27T14:02:12Z",
          "linked_at": "2026-09-27T14:02:12Z",
          "updated_at": "2026-09-27T14:02:12Z"
        }
      }
    },
    {
      "test_case_id": "TC-002",
      "title": "Invalid password is rejected with a clear error",
      "description": "[Equivalence partition] Negative case: the user submits a wrong password. The form rejects the credentials and shows an error.",
      "risk_ids": ["RISK-001"],
      "acceptance_criteria_refs": [1],
      "priority": "P1",
      "test_level_recommendation": "e2e",
      "automation_decision": "automate_e2e",
      "automation_decision_reason": "The AC explicitly says the user remains on the login page AND sees an error message. The 'sees an error' part is a UI assertion and belongs at E2E. The 'no partial session' part is also covered by API but is asserted here too because the user-facing behaviour is what the AC names.",
      "preconditions": [
        "A non-locked user account exists in the test environment."
      ],
      "steps": [
        {
          "step_id": "S-01",
          "action": "Navigate to BASE_URL."
        },
        {
          "step_id": "S-02",
          "action": "Fill the username field.",
          "data": "standard_user"
        },
        {
          "step_id": "S-03",
          "action": "Fill the password field with a wrong value.",
          "data": "wrong-password"
        },
        {
          "step_id": "S-04",
          "action": "Click the Login button."
        }
      ],
      "expected_results": [
        "URL remains on the login page.",
        "An error message is visible explaining the credentials were not accepted."
      ],
      "status": "approved",
      "design_stage": "ready_for_qa",
      "sync_state": {
        "jira": {
          "operation_key": "jira:SK:SK-1042:TC-002:create_case",
          "marker": "qaizen-op-f3b094403d2f",
          "marker_searchable": true,
          "payload_digest": "7006a3688c2afaa85ae78381c3187d6a3d70d8b2d451e80cc8fc875d74868013",
          "source_digest": "c8df38ba8c42cc96e4bd402a79697585ae5991d928f045a1fce09c0eadc1eb02",
          "state": "pending",
          "intent_at": "2026-09-27T14:02:13Z",
          "updated_at": "2026-09-27T14:02:43Z",
          "last_error": "timed out waiting for a response"
        }
      }
    },
    {
      "test_case_id": "TC-004",
      "title": "Visual review of login error styling",
      "description": "[Checklist] Subjective check that the error banner is legible and on-brand. Captured for manual execution; not automated.",
      "risk_ids": ["RISK-001"],
      "acceptance_criteria_refs": [1, 2],
      "priority": "P3",
      "test_level_recommendation": "e2e",
      "automation_decision": "manual",
      "automation_decision_reason": "The check is about visual quality — colour, contrast, copy readability — which automated assertions cannot judge reliably. Marked manual so it still appears on the QA checklist but does not bloat the automation suite.",
      "preconditions": ["A registered user account exists."],
      "steps": [
        {
          "step_id": "S-01",
          "action": "Trigger an invalid-credentials error and inspect the banner visually."
        }
      ],
      "expected_results": [
        "The banner uses an error colour and is readable against the page background.",
        "The copy is specific enough that a non-technical user knows what to do next."
      ],
      "status": "approved",
      "sync_state": {
        "jira": {
          "operation_key": "jira:SK:SK-1042:TC-004:create_case",
          "marker": "qaizen-op-05d83a71ac85",
          "marker_searchable": true,
          "payload_digest": "6c51c3653dd957d8dab9e8e668fb8cd9c173574228d6687f8f43a4831274b4a5",
          "source_digest": "42e50520baa29bc0daccc96d70d3cd5298a2dc4a72f6a76fdb1099ff41502368",
          "state": "failed",
          "intent_at": "2026-09-27T13:58:02Z",
          "updated_at": "2026-09-27T13:58:03Z",
          "last_error": "HTTP 400: {\"errors\":{\"issuetype\":\"Specify a valid issue type\"}}"
        }
      }
    }
  ]
}
