{
  "schema_version": "1.0",
  "run_id": "2026-05-31T18-00-00Z-apiex",
  "story_id": "API-001",
  "generated_at": "2026-05-31T18:05:00Z",
  "test_cases": [
    {
      "test_case_id": "TC-001",
      "title": "Create user returns 201 with id and createdAt",
      "description": "[Use case] POST /users with a valid name and job creates a user and returns 201 with an id and a createdAt timestamp.",
      "risk_ids": ["RISK-001"],
      "acceptance_criteria_refs": [0],
      "priority": "P1",
      "test_level_recommendation": "api",
      "automation_decision": "automate_api",
      "automation_decision_reason": "This is a server-side contract: a POST that returns a specific status and response shape. There is no UI to exercise; an API test verifies the contract deterministically. Per docs/automation-decision-model.md, data-shape and status-code checks belong at the API level.",
      "preconditions": [
        "The API base URL is configured via the Postman environment (reqres.in)."
      ],
      "steps": [
        {
          "step_id": "S-01",
          "action": "POST to /users with a JSON body.",
          "data": { "name": "morpheus", "job": "leader" }
        }
      ],
      "expected_results": [
        "Response status code is 201.",
        "Response body contains a non-empty 'id'.",
        "Response body contains a 'createdAt' timestamp."
      ],
      "status": "approved",
      "api_metadata": {
        "method": "POST",
        "endpoint": "/users",
        "auth_required": false,
        "expected_status_codes": [201]
      }
    },
    {
      "test_case_id": "TC-002",
      "title": "Register with missing password is rejected",
      "description": "[Equivalence partition] POST /register with an email but no password returns 400 with an error message — reqres.in's documented missing-field failure mode.",
      "risk_ids": ["RISK-001"],
      "acceptance_criteria_refs": [1],
      "priority": "P1",
      "test_level_recommendation": "api",
      "automation_decision": "automate_api",
      "automation_decision_reason": "Negative validation case at the API contract level: a missing required field must be rejected with 400 and a clear error. Negative API validation is a primary use of automate_api per docs/automation-decision-model.md.",
      "preconditions": [
        "The API base URL is configured via the Postman environment (reqres.in)."
      ],
      "steps": [
        {
          "step_id": "S-01",
          "action": "POST to /register with only an email field.",
          "data": { "email": "sydney@fife" }
        }
      ],
      "expected_results": [
        "Response status code is 400.",
        "Response body contains an 'error' field mentioning the missing password."
      ],
      "status": "approved",
      "api_metadata": {
        "method": "POST",
        "endpoint": "/register",
        "auth_required": false,
        "expected_status_codes": [400]
      }
    }
  ]
}
